{
  "schemaVersion": "1",
  "root": "/knowledge",
  "revision": {
    "specVersion": "0.1",
    "indexSha256": "0000000000000000000000000000000000000000000000000000000000000000"
  },
  "graphIri": "urn:openknowledge:revision:0000000000000000000000000000000000000000000000000000000000000000",
  "quads": []
}
